{
  "$id": "urn:agent-hook-kit:contracts:claude-code:docs-2026-09-30-r1:pre-model-switch:input",
  "$schema": "https://json-schema.org/draft/2020-12/schema",
  "additionalProperties": true,
  "properties": {
    "agent_id": {
      "type": "string"
    },
    "agent_type": {
      "type": "string"
    },
    "cache_ttl": {
      "enum": [
        "5m",
        "1h"
      ]
    },
    "context_tokens": {
      "minimum": 0,
      "type": "integer"
    },
    "cwd": {
      "type": "string"
    },
    "effort": {
      "additionalProperties": true,
      "properties": {
        "level": {
          "description": "Open string: the Agent SDK types it as string; the examples are the documented levels.",
          "examples": [
            "low",
            "medium",
            "high",
            "xhigh",
            "max"
          ],
          "type": "string"
        }
      },
      "required": [
        "level"
      ],
      "type": "object"
    },
    "estimated_cache_write_usd": {
      "minimum": 0,
      "type": "number"
    },
    "from_model": {
      "type": "string"
    },
    "hook_event_name": {
      "const": "PreModelSwitch"
    },
    "permission_mode": {
      "description": "Open string: the Agent SDK types it as string; the examples are the documented modes.",
      "examples": [
        "default",
        "plan",
        "acceptEdits",
        "auto",
        "dontAsk",
        "bypassPermissions"
      ],
      "type": "string"
    },
    "pricing": {
      "enum": [
        "configured",
        "catalog",
        "default"
      ]
    },
    "prompt_cache_warm": {
      "type": "boolean"
    },
    "prompt_id": {
      "type": "string"
    },
    "requested_model": {
      "type": [
        "string",
        "null"
      ]
    },
    "scratchpad_dir": {
      "description": "Session scratchpad directory; absent when the session has none or the temp directory is unavailable (Claude Code v2.1.257 or later).",
      "type": "string"
    },
    "session_id": {
      "type": "string"
    },
    "source": {
      "enum": [
        "command",
        "picker",
        "sdk"
      ]
    },
    "to_model": {
      "type": "string"
    },
    "transcript_path": {
      "type": "string"
    }
  },
  "required": [
    "session_id",
    "transcript_path",
    "cwd",
    "hook_event_name",
    "from_model",
    "to_model",
    "requested_model",
    "source",
    "context_tokens",
    "prompt_cache_warm",
    "cache_ttl",
    "estimated_cache_write_usd",
    "pricing"
  ],
  "type": "object"
}
