{
  "session_id": "abc-123-def",
  "transcript_path": "/tmp/claude/transcript-abc.jsonl",
  "cwd": "/home/user/project",
  "hook_event_name": "PreModelSwitch",
  "from_model": "claude-sonnet-5",
  "to_model": "claude-opus-5",
  "requested_model": "opus",
  "source": "command",
  "context_tokens": 182340,
  "prompt_cache_warm": true,
  "cache_ttl": "5m",
  "estimated_cache_write_usd": 1.1396,
  "pricing": "catalog"
}
